{
  "$schema": "https://json-schema.org/draft/2020-12/schema",
  "$id": "https://local-llm-vram-atlas.local/schemas/evidence.schema.json",
  "title": "AtlasEvidenceRecord",
  "description": "Links one important claim to its provenance. Provenance over duplication: evidence records reference sources instead of copying long external content. Specification version 0.1.0.",
  "type": "object",
  "additionalProperties": false,
  "required": [
    "schema_version",
    "evidence_id",
    "claim_type",
    "source_id",
    "evidence_level",
    "verification_status",
    "retrieved_at"
  ],
  "properties": {
    "schema_version": {
      "type": "string",
      "pattern": "^0\\.[0-9]+\\.[0-9]+$",
      "description": "Specification version of this record (0.x during initial development)."
    },
    "evidence_id": {
      "type": "string",
      "pattern": "^[a-z0-9][a-z0-9-]{1,120}$"
    },
    "claim_type": {
      "type": "string",
      "enum": ["vram_requirement", "benchmark_score", "license_term", "openness_class", "runtime_support", "quantization_property", "alignment_property", "architecture_property", "popularity_signal", "other"],
      "description": "What kind of claim this evidence supports."
    },
    "field_path": {
      "type": ["string", "null"],
      "description": "Dotted path of the claim inside the target record, e.g. 'vram.measured_vram_gib'."
    },
    "source_id": {
      "type": "string",
      "minLength": 1,
      "description": "Reference to a record conforming to source.schema.json."
    },
    "source_type": {
      "type": ["string", "null"],
      "enum": ["official_repo", "official_docs", "official_license", "official_spec", "paper", "independent_benchmark", "independent_measurement", "quantizer_repo", "technical_report", "community_issue", "community_discussion", "forum", "other", null]
    },
    "source_url": {
      "type": ["string", "null"],
      "format": "uri",
      "pattern": "^https?://\\S+$",
      "description": "Absolute http(s) URL. Relative strings and bare text are rejected by the pattern constraint."
    },
    "retrieved_at": {
      "type": "string",
      "format": "date-time",
      "description": "ISO 8601 retrieval timestamp with timezone. Links to main/master branches are not immutable revisions."
    },
    "publisher": { "type": ["string", "null"] },
    "evidence_level": {
      "type": "string",
      "enum": ["publisher_claim", "quantizer_claim", "community_report", "independent_measurement", "atlas_measurement"],
      "description": "Publisher, quantizer, and community statements stay distinct from independent and Atlas measurements."
    },
    "verification_status": {
      "type": "string",
      "enum": ["unknown", "unverified", "estimated", "publisher_claim", "quantizer_claim", "independently_verified", "atlas_verified"]
    },
    "notes": { "type": ["string", "null"], "maxLength": 2000 }
  }
}
