{
  "claim_type": "quantization_property",
  "evidence_id": "ev-v2-f74ace1e553ebf2f032a21ea24ff8ab7dfa54afb9945e1ccc984afc764cc552e",
  "evidence_level": "publisher_claim",
  "field_path": "quantization.native_quantization",
  "notes": "Source-reported training-time quantization method 'mxfp4'; native low-bit is a training property, not a post-training quantization, so no base-vs-quant retention is implied",
  "publisher": "openai",
  "retrieved_at": "2026-10-05T00:00:00Z",
  "schema_version": "0.1.0",
  "source_id": "core-12g-03-gpt-oss-20b-mxfp4-gguf-current-src",
  "source_type": "official_repo",
  "source_url": "https://huggingface.co/openai/gpt-oss-20b",
  "verification_status": "independently_verified"
}
