{
  "claim_type": "quantization_property",
  "evidence_id": "ev-v2-4becb85aaecb45adb3cc54d2b0258b74284e8f01b2466749c50c9b40536d1515",
  "evidence_level": "publisher_claim",
  "field_path": "quantization.source_revision",
  "notes": "Current resolved revision and exact artifact identity reacquired anonymously; repo=microsoft/Phi-3-mini-4k-instruct; revision=f39ac1d28e925b323eae81227eaba4464caced4e; artifact=microsoft-phi-3-mini-4k-instruct--safetensors--model.safetensors",
  "publisher": "microsoft",
  "retrieved_at": "2026-10-05T00:00:00Z",
  "schema_version": "0.1.0",
  "source_id": "core-8g-04-phi-3-mini-4k-current-src",
  "source_type": "official_repo",
  "source_url": "https://huggingface.co/microsoft/Phi-3-mini-4k-instruct",
  "verification_status": "independently_verified"
}
