{
  "claim_type": "license_term",
  "evidence_id": "google-gemma-4-12b-ev-license-license-id",
  "evidence_level": "publisher_claim",
  "field_path": "license.license_id",
  "notes": "repo_id=google/gemma-4-12B; resolved_revision=023679ed352de9bb66cc873c9009ce3482585c08; requested_revision=main",
  "publisher": "google",
  "retrieved_at": "2026-10-05T06:10:12.659336Z",
  "schema_version": "0.1.0",
  "source_id": "google-gemma-4-12b-src-hf",
  "source_type": "official_repo",
  "source_url": "https://huggingface.co/google/gemma-4-12B",
  "verification_status": "publisher_claim"
}
